Enter your text,output,flag,username,timestamp
"Kiran is not registered for maths subject
",Kiran is not registered for the Maths subject.,,,2023-08-22 19:02:18.454962
Kiran is not registered for maths subject,Kiran is not registered for the Maths subject.,,,2023-08-22 19:32:20.092796
Subjects registered by Shyam,"Shyam has registered for the following subjects: Hindi, English, and Maths.",,,2023-08-22 19:34:09.031977
"Kiran is not registered for maths
",Kiran is not registered for maths.,,,2023-08-22 19:36:43.429757
Who all registered for Maths,Shyam and Pawan registered for Maths.,,,2023-08-22 19:40:30.823310
